{"$schema":"https://json-schema.org/draft/2020-12/schema","type":"object","additionalProperties":false,"required":["schema","section_id","group_id","run_id","verdict","findings","review_budget"],"properties":{"schema":{"const":"section-review/v1"},"section_id":{"enum":["S0","S1","S2"]},"group_id":{"type":"string","minLength":1},"run_id":{"type":"string","minLength":1},"verdict":{"enum":["accepted","rejected"]},"findings":{"type":"array","items":{"type":"object","additionalProperties":false,"required":["id","state"],"properties":{"id":{"type":"string","minLength":1},"state":{"enum":["candidate","required","defer","reject","needs-user"]}}}},"review_budget":{"type":"object","additionalProperties":false,"required":["max_fixes","consumed"],"properties":{"max_fixes":{"const":5},"consumed":{"type":"array","items":{"type":"object","additionalProperties":false,"required":["finding_id","attempt"],"properties":{"finding_id":{"type":"string","minLength":1},"attempt":{"type":"integer","minimum":1,"maximum":5}}}}}}}}
