{"findings":[{"id":"S0-W1-F001","state":"required"},{"id":"S0-W1-F002","state":"required"},{"id":"S0-W1-F003","state":"required"},{"id":"S0-W1-F004","state":"required"},{"id":"S0-W1-F005","state":"required"},{"id":"S0-W1-F006","state":"required"},{"id":"S0-W1-F007","state":"required"},{"id":"S0-W1-F008","state":"required"},{"id":"S0-C-F001","state":"required"},{"id":"S0-D-F001","state":"required"},{"id":"S0-E-F001","state":"required"},{"id":"S0-E-F002","state":"required"},{"id":"S0-E-F003","state":"required"},{"id":"S0-E-F004","state":"required"}],"group_id":"contracts-and-schema","review_budget":{"consumed":[{"attempt":1,"finding_id":"S0-W1-F001"},{"attempt":2,"finding_id":"S0-W1-F001"},{"attempt":1,"finding_id":"S0-W1-F002"},{"attempt":2,"finding_id":"S0-W1-F002"},{"attempt":1,"finding_id":"S0-W1-F003"},{"attempt":1,"finding_id":"S0-W1-F004"},{"attempt":2,"finding_id":"S0-W1-F004"},{"attempt":1,"finding_id":"S0-W1-F005"},{"attempt":2,"finding_id":"S0-W1-F005"},{"attempt":1,"finding_id":"S0-W1-F006"},{"attempt":1,"finding_id":"S0-W1-F007"},{"attempt":2,"finding_id":"S0-W1-F007"},{"attempt":1,"finding_id":"S0-W1-F008"},{"attempt":2,"finding_id":"S0-W1-F008"},{"attempt":1,"finding_id":"S0-C-F001"},{"attempt":2,"finding_id":"S0-C-F001"},{"attempt":3,"finding_id":"S0-C-F001"},{"attempt":1,"finding_id":"S0-D-F001"},{"attempt":2,"finding_id":"S0-D-F001"},{"attempt":1,"finding_id":"S0-E-F001"},{"attempt":1,"finding_id":"S0-E-F002"},{"attempt":2,"finding_id":"S0-E-F002"},{"attempt":1,"finding_id":"S0-E-F003"},{"attempt":2,"finding_id":"S0-E-F003"},{"attempt":3,"finding_id":"S0-E-F003"},{"attempt":1,"finding_id":"S0-E-F004"}],"max_fixes":5},"run_id":"s0-source-transition-2026-09-04","schema":"section-review/v1","section_id":"S0","verdict":"accepted"}
