{"findings":[{"id":"S1-CSR-001","state":"required"},{"id":"S1-LIFE-001","state":"required"},{"id":"S1-LIFE-002","state":"required"},{"id":"S1-LIFE-003","state":"required"},{"id":"S1-A-BR-001","state":"required"},{"id":"S1-A-BR-002","state":"required"},{"id":"S1-A-BR-003","state":"required"},{"id":"S1-A-BR-004","state":"required"},{"id":"S1-SC-KERNEL-AUTHORITY-DISJOINT","state":"required"},{"id":"S1-SC-F5-STALE-ADVICE-ACCEPTED","state":"required"},{"id":"S1-SC-F4-DAG-BYPASS","state":"required"},{"id":"S1-SC-RESULT-EMPTY-VALID","state":"required"},{"id":"S1-SC-F8-INTEGRITY-ERROR-ESCAPES","state":"required"},{"id":"S1-C-UPSTREAM-OPEN-GROUP-ADAPTER-001","state":"required"},{"id":"S1-C-UPSTREAM-OPEN-GROUP-HISTORY-002","state":"required"},{"id":"S1-C-COMPAT-DOWNSTREAM-TEST-BINDING-001","state":"required"},{"id":"FV-S1D-001","state":"required"},{"id":"FV-S1D-002","state":"required"},{"id":"FV-S1D-003","state":"required"},{"id":"C-S1D-PF-001","state":"required"},{"id":"C-S1E-SCHEMA-001","state":"required"},{"id":"S1E-CLOSE-ROOT-001","state":"required"},{"id":"S1E-FINDING-HISTORY-001","state":"required"},{"id":"S1E-CLOSE-ROOT-002","state":"reject"},{"id":"S1E-CLOSE-GRAPH-001","state":"defer"}],"group_id":"bootstrap-and-shared-closure","review_budget":{"consumed":[{"attempt":1,"finding_id":"S1-CSR-001"},{"attempt":2,"finding_id":"S1-CSR-001"},{"attempt":1,"finding_id":"S1-LIFE-001"},{"attempt":2,"finding_id":"S1-LIFE-001"},{"attempt":1,"finding_id":"S1-LIFE-002"},{"attempt":2,"finding_id":"S1-LIFE-002"},{"attempt":1,"finding_id":"S1-LIFE-003"},{"attempt":2,"finding_id":"S1-LIFE-003"},{"attempt":1,"finding_id":"S1-A-BR-001"},{"attempt":1,"finding_id":"S1-A-BR-002"},{"attempt":1,"finding_id":"S1-A-BR-003"},{"attempt":1,"finding_id":"S1-A-BR-004"},{"attempt":1,"finding_id":"S1-SC-KERNEL-AUTHORITY-DISJOINT"},{"attempt":1,"finding_id":"S1-SC-F5-STALE-ADVICE-ACCEPTED"},{"attempt":1,"finding_id":"S1-SC-F4-DAG-BYPASS"},{"attempt":1,"finding_id":"S1-SC-RESULT-EMPTY-VALID"},{"attempt":1,"finding_id":"S1-SC-F8-INTEGRITY-ERROR-ESCAPES"},{"attempt":1,"finding_id":"S1-C-UPSTREAM-OPEN-GROUP-ADAPTER-001"},{"attempt":1,"finding_id":"S1-C-UPSTREAM-OPEN-GROUP-HISTORY-002"},{"attempt":1,"finding_id":"S1-C-COMPAT-DOWNSTREAM-TEST-BINDING-001"},{"attempt":1,"finding_id":"FV-S1D-001"},{"attempt":1,"finding_id":"FV-S1D-002"},{"attempt":1,"finding_id":"FV-S1D-003"},{"attempt":1,"finding_id":"C-S1D-PF-001"},{"attempt":1,"finding_id":"C-S1E-SCHEMA-001"},{"attempt":1,"finding_id":"S1E-CLOSE-ROOT-001"},{"attempt":2,"finding_id":"S1E-CLOSE-ROOT-001"},{"attempt":1,"finding_id":"S1E-FINDING-HISTORY-001"},{"attempt":2,"finding_id":"S1E-FINDING-HISTORY-001"}],"max_fixes":5},"run_id":"s1-source-close-2026-09-05","schema":"section-review/v1","section_id":"S1","verdict":"accepted"}
